[
  {
    "id": "notable-person-albena-branzova",
    "wikidata_id": "Q2830854",
    "name_bg": "Албена Брънзова-Димитрова",
    "name_en": "Albena Branzova",
    "description_bg": "българска баскетболистка",
    "description_en": "Bulgarian basketball player",
    "roles": [
      "athlete",
      "basketball_player"
    ],
    "birth_year": 1971,
    "death_year": null,
    "source": {
      "title": "Wikipedia — Albena Branzova",
      "url": "https://en.wikipedia.org/wiki/Albena_Branzova",
      "accessed_at": "2026-06-19"
    },
    "data_quality": "public_source"
  },
  {
    "id": "notable-person-aleksandra-monedzhikova",
    "wikidata_id": "Q28324141",
    "name_bg": "Александра Монеджикова",
    "name_en": "Aleksandra Monedzhikova",
    "description_bg": "българска географка",
    "description_en": "Bulgarian geographer",
    "roles": [
      "geographer",
      "scholar"
    ],
    "birth_year": 1889,
    "death_year": 1959,
    "source": {
      "title": "Wikipedia — Aleksandra Monedzhikova",
      "url": "https://en.wikipedia.org/wiki/Aleksandra_Monedzhikova",
      "accessed_at": "2026-06-19"
    },
    "data_quality": "public_source"
  },
  {
    "id": "notable-person-aleksandra-nacheva",
    "wikidata_id": "Q55569450",
    "name_bg": "Александра Начева",
    "name_en": "Aleksandra Nacheva",
    "description_bg": "българска лекоатлетка",
    "description_en": "Bulgarian athlete",
    "roles": [
      "athlete"
    ],
    "birth_year": 2001,
    "death_year": null,
    "source": {
      "title": "Wikipedia — Aleksandra Nacheva",
      "url": "https://en.wikipedia.org/wiki/Aleksandra_Nacheva",
      "accessed_at": "2026-06-19"
    },
    "data_quality": "public_source"
  },
  {
    "id": "notable-person-aleksandrina-naydenova",
    "wikidata_id": "Q4715613",
    "name_bg": "Александрина Найденова",
    "name_en": "Aleksandrina Naydenova",
    "description_bg": "българска тенисистка",
    "description_en": "Bulgarian tennis player",
    "roles": [
      "athlete",
      "tennis_player"
    ],
    "birth_year": 1992,
    "death_year": null,
    "source": {
      "title": "Wikipedia — Aleksandrina Naydenova",
      "url": "https://en.wikipedia.org/wiki/Aleksandrina_Naydenova",
      "accessed_at": "2026-06-19"
    },
    "data_quality": "public_source"
  },
  {
    "id": "notable-person-angelina-mikhaylova",
    "wikidata_id": "Q2493179",
    "name_bg": "Ангелина Михайлова",
    "name_en": "Angelina Mikhaylova",
    "description_bg": "българска баскетболистка",
    "description_en": "Olympic medalist in basketball",
    "roles": [
      "athlete",
      "basketball_player"
    ],
    "birth_year": 1960,
    "death_year": null,
    "source": {
      "title": "Wikipedia — Angelina Mikhaylova",
      "url": "https://en.wikipedia.org/wiki/Angelina_Mikhaylova",
      "accessed_at": "2026-06-19"
    },
    "data_quality": "public_source"
  },
  {
    "id": "notable-person-angel-wagenstein",
    "wikidata_id": "Q531900",
    "name_bg": "Анжел Вагенщайн",
    "name_en": "Angel Wagenstein",
    "description_bg": "български режисьор, сценарист и писател",
    "description_en": "Bulgarian film director, screenwriter and writer",
    "roles": [
      "film_director",
      "screenwriter",
      "writer"
    ],
    "birth_year": 1922,
    "death_year": 2023,
    "source": {
      "title": "Wikipedia — Angel Wagenstein",
      "url": "https://en.wikipedia.org/wiki/Angel_Wagenstein",
      "accessed_at": "2026-06-19"
    },
    "data_quality": "public_source"
  },
  {
    "id": "notable-person-apostolos-nikolaidis",
    "wikidata_id": "Q331223",
    "name_bg": "Апостолос Николаидис",
    "name_en": "Apostolos Nikolaidis",
    "description_bg": "гръцки спортист и футболист, роден в Пловдив",
    "description_en": "Greek footballer and athlete",
    "roles": [
      "athlete",
      "footballer"
    ],
    "birth_year": 1896,
    "death_year": 1980,
    "source": {
      "title": "Wikipedia — Apostolos Nikolaidis",
      "url": "https://en.wikipedia.org/wiki/Apostolos_Nikolaidis_(athlete)",
      "accessed_at": "2026-06-19"
    },
    "data_quality": "public_source"
  },
  {
    "id": "notable-person-asen-kisimov",
    "wikidata_id": "Q4804159",
    "name_bg": "Асен Кисимов",
    "name_en": "Asen Kisimov",
    "description_bg": "български актьор",
    "description_en": "Bulgarian actor",
    "roles": [
      "actor"
    ],
    "birth_year": 1936,
    "death_year": 2005,
    "source": {
      "title": "Wikipedia — Asen Kisimov",
      "url": "https://en.wikipedia.org/wiki/Asen_Kisimov",
      "accessed_at": "2026-06-19"
    },
    "data_quality": "public_source"
  },
  {
    "id": "notable-person-assia-zlatkowa",
    "wikidata_id": "Q4808843",
    "name_bg": "Ася Златкова",
    "name_en": "Assia Zlatkowa",
    "description_bg": "пианистка",
    "description_en": "Danish pianist born in Plovdiv",
    "roles": [
      "pianist",
      "musician"
    ],
    "birth_year": 1953,
    "death_year": null,
    "source": {
      "title": "Wikipedia — Assia Zlatkowa",
      "url": "https://en.wikipedia.org/wiki/Assia_Zlatkowa",
      "accessed_at": "2026-06-19"
    },
    "data_quality": "public_source"
  },
  {
    "id": "notable-person-atanas-hranov",
    "wikidata_id": "Q27230293",
    "name_bg": "Атанас Хранов",
    "name_en": "Atanas Hranov",
    "description_bg": "български художник",
    "description_en": "Bulgarian painter",
    "roles": [
      "artist",
      "painter"
    ],
    "birth_year": 1961,
    "death_year": null,
    "source": {
      "title": "Wikipedia — Atanas Hranov",
      "url": "https://en.wikipedia.org/wiki/Atanas_Hranov",
      "accessed_at": "2026-06-19"
    },
    "data_quality": "public_source"
  },
  {
    "id": "notable-person-ahmed-hilmi-of-filibe",
    "wikidata_id": "Q4695337",
    "name_bg": "Ахмед Хилми от Пловдив",
    "name_en": "Şehbenderzade Ahmed Hilmi",
    "description_bg": "турскоезичен османски суфист и писател",
    "description_en": "Ottoman writer",
    "roles": [
      "writer",
      "clergy"
    ],
    "birth_year": 1865,
    "death_year": 1914,
    "source": {
      "title": "Wikipedia — Ahmed Hilmi of Filibe",
      "url": "https://en.wikipedia.org/wiki/Ahmed_Hilmi_of_Filibe",
      "accessed_at": "2026-06-19"
    },
    "data_quality": "public_source"
  },
  {
    "id": "notable-person-bogdan-dobranov",
    "wikidata_id": "Q4937469",
    "name_bg": "Богдан Добранов",
    "name_en": "Bogdan Stefanov Dobranov",
    "description_bg": "български католически духовник",
    "description_en": "Bulgarian clergyman",
    "roles": [
      "clergy"
    ],
    "birth_year": 1914,
    "death_year": 1983,
    "source": {
      "title": "Wikipedia — Bogdan Stefanov Dobranov",
      "url": "https://en.wikipedia.org/wiki/Bogdan_Stefanov_Dobranov",
      "accessed_at": "2026-06-19"
    },
    "data_quality": "public_source"
  },
  {
    "id": "notable-person-bojidara-kouzmanova",
    "wikidata_id": "Q891182",
    "name_bg": "Божидара Кузманова",
    "name_en": "Bojidara Kouzmanova",
    "description_bg": "българска цигуларка",
    "description_en": "Bulgarian violinist",
    "roles": [
      "violinist",
      "musician"
    ],
    "birth_year": 1977,
    "death_year": null,
    "source": {
      "title": "Wikipedia — Bojidara Kouzmanova",
      "url": "https://en.wikipedia.org/wiki/Bojidara_Kouzmanova",
      "accessed_at": "2026-06-19"
    },
    "data_quality": "public_source"
  },
  {
    "id": "notable-person-boris-grezhov",
    "wikidata_id": "Q12273675",
    "name_bg": "Борис Грежов",
    "name_en": "Boris Grezhov",
    "description_bg": "български актьор",
    "description_en": "Bulgarian actor",
    "roles": [
      "actor"
    ],
    "birth_year": 1889,
    "death_year": 1968,
    "source": {
      "title": "Wikipedia — Boris Grezov",
      "url": "https://en.wikipedia.org/wiki/Boris_Grezov",
      "accessed_at": "2026-06-19"
    },
    "data_quality": "public_source"
  },
  {
    "id": "notable-person-boris-christoff",
    "wikidata_id": "Q362106",
    "name_bg": "Борис Христов",
    "name_en": "Boris Christoff",
    "description_bg": "български оперен певец",
    "description_en": "Bulgarian bass singer",
    "roles": [
      "opera_singer",
      "musician"
    ],
    "birth_year": 1914,
    "death_year": 1993,
    "source": {
      "title": "Wikipedia — Boris Christoff",
      "url": "https://en.wikipedia.org/wiki/Boris_Christoff",
      "accessed_at": "2026-06-19"
    },
    "portrait": {
      "url": "https://upload.wikimedia.org/wikipedia/commons/b/bb/%D0%91%D0%BE%D1%80%D0%B8%D1%81_%D0%A5%D1%80%D0%B8%D1%81%D1%82%D0%BE%D0%B2._crop.jpg",
      "page_url": "https://commons.wikimedia.org/wiki/File:%D0%91%D0%BE%D1%80%D0%B8%D1%81_%D0%A5%D1%80%D0%B8%D1%81%D1%82%D0%BE%D0%B2._crop.jpg",
      "credit": "Maxim Malkov scan; M. P. Malkov archive",
      "license": "CC0",
      "license_url": "https://creativecommons.org/publicdomain/zero/1.0/",
      "accessed_at": "2026-07-14"
    },
    "data_quality": "public_source"
  },
  {
    "id": "notable-person-boyan-petkanchin",
    "wikidata_id": "Q12273874",
    "name_bg": "Боян Петканчин",
    "name_en": "Boyan Petkanchin",
    "description_bg": "български математик",
    "description_en": "Bulgarian logician",
    "roles": [
      "mathematician",
      "scholar"
    ],
    "birth_year": 1907,
    "death_year": 1987,
    "source": {
      "title": "Wikipedia — Boyan Petkanchin",
      "url": "https://en.wikipedia.org/wiki/Boyan_Petkanchin",
      "accessed_at": "2026-06-19"
    },
    "data_quality": "public_source"
  },
  {
    "id": "notable-person-vaklush-tolev",
    "wikidata_id": "Q17409993",
    "name_bg": "Ваклуш Толев",
    "name_en": "Vaklush Tolev",
    "description_bg": "български офицер и духовен автор",
    "description_en": "Bulgarian military officer",
    "roles": [
      "military_officer",
      "writer"
    ],
    "birth_year": 1923,
    "death_year": 2013,
    "source": {
      "title": "Wikipedia — Vaklush Tolev",